<?xml version="1.0" encoding="UTF-8"?> 
<libros xmlns:xsi="http://www.w3.org/2001/XMLSchema-instance"
    xsi:noNamespaceSchemaLocation="ej_24_XSD.xsd">
 <libro> 
   <titulo>El Principito</titulo> 
   <autor>Antoine de Saint-Exupéry</autor> 
   Un clásico de la literatura infantil. 
   <año>1943</año> 
 </libro> 
 <libro> 
   <titulo>Cien años de soledad</titulo> 
   <autor>Gabriel García Márquez</autor> 
   Novela maestra del realismo mágico. 
   <año>1967</año> 
 </libro> 
</libros>
